Key,Description,Standard,pt-br,uk,ru,zh-TW
SAY.ENIntro.153.Ellie,,"{i}(Well, I say we clean up “crime scenes,” but I’ve only done robberies that involve broken glass so far. I guess Miss is only confident in my glass repairing skills.)","{i}(Bom, eu digo que limpamos ""cenas de crime"", mas, até agora, só limpei cenas de roubo que envolviam vidro quebrado. Eu acho que a Dona só confia nas minhas habilidades de reparo de vidro.)","{i}(Ну, я сказала «сцени злочину», але досі я розбиралася лише з наслідками пограбувань та розбитим склом. Гадаю, Панна впевнена в моїх навичках ремонтування скла.)","{i}(Ну, я говорю, что мы убираем «места преступлений», но до сих пор я только убиралась после ограблений с разбитыми витринами. Похоже, мисс доверяет только моим умениям в ремонте стекла.)",{i}（雖然我們清理的是「犯案現場」但是我目前處理的也頂多是修復偷竊案後的碎玻璃，看來小姐目前只相信我修復玻璃的能力吧！）
SAY.ENIntro.157.Ellie,,What -- what am I wearing??{wc}Wow... I actually look really cute in this costume.{wc}Who knew wearing so many ruffles could fit me so well?,"O que... o que estou vestindo??{wc}Uau... na verdade, eu fiquei bem fofa com esse traje.{wc}Quem diria que usar tantos babados combinaria tanto comigo?","Що? Що це на мене вдягнуто???{wc}Воу... А я виглядаю дійсно мило в цьому.{wc}Хто ж знав, що так багато рюшів личитиме мені?","Что — что я на себе ношу??{wc} Вау... я действительно выгляжу мило в этом костюме.{wc} Кто бы мог подумать, что столько рюшей мне так подходит?",我......我到底身上穿了什麼啊！{wc}哇！這服裝穿起來好可愛啊！{wc}誰知道穿這麼多摺邊會這麼合？
SAY.ENIntro.159.???,,"Hello, dear!","Olá, querida!","Вітаю, люба.","Привет, дорогая!",妳好啊！
SAY.ENIntro.161.Ellie,,WAAAH!{wc}What the melon?? {wi}...Who are you?,AHHHH!{wc}Santo melão!? {wi}...Quem é você?,АААА!{wc}Матінко гарбузова! {wi}...Ви хто?,ААААА!{wc} Что за дичь?? {wi}...Ты кто?,啊啊啊！{wc}發生什麼事！？{wi}妳是誰！？
SAY.ENIntro.163.???,,..? {wi}You walked into my company and you’re asking who I am?,..?{wi} Você entrou na minha empresa e está perguntando quem sou eu?,..? {wi}Ти прийшла в мою компанію й питаєш мене це?,"..? {wi}Ты заявилась ко мне в компанию и ещё спрашиваешь, кто я?",？{wi}妳走進了我的公司還問我是誰？
SAY.ENIntro.165.Ellie,,"OH!! {w=0.5}Oh, I’m so sorry! I didn’t realize! I got distracted by-- uh, my dress, like...","AH!! {w=0.5}Ah, me desculpe! Eu não percebi! Eu me distraí com... é, meu traje, tipo...","ОЙ! {w=0.5}Ох, вибачте! Я не збагнула! Мене збило з пантелику моє... е-е, вбрання...","ОЙ!! {w=0.5}Ой, прости! Я не заметила! Просто задумалась о... эм, своём платье, как бы...",歐！{w=0.5}歐，真是抱歉！我沒注意到！我被我自己的女僕裝分神了。
SAY.ENIntro.167.???,,"Hahaha, you’re an adorable one.{wc}Did you come here because you were interested in our job listing?","Hahaha, você é adorável.{wc}Você veio aqui porque está interessada em trabalhar conosco?","Ха-ха-ха, а ти мила.{wc}Ти прийшла сюди через відкриті вакансії?","Хахаха, какая же ты прелесть.{wc} Ты здесь из-за нашего объявления о работе?",呵呵呵妳好可愛啊！{wc}妳是來這邊應徵的吧！
SAY.ENIntro.169.Ellie,,Ummmm... I guess??,"Hummm... Sim, talvez??","Ем-м, так... гадаю?",Ммм... Пожалуй??,ㄜ......我猜？？？
SAY.ENIntro.171.Ellie,,"Truthfully, I came in here to ask about that, but I have no idea how I got in this dress, I swear it was some magical girl type of thing... {wc}I don’t know, I probably sound really crazy right now, but I seriously am so confused!","Sinceramente, eu vim aqui para perguntar sobre isso, mas eu não tenho ideia de como acabei com esse traje, eu juro que foi algum tipo de mágica... {wc}Eu não sei, devo estar parecendo ser louca, mas estou realmente confusa!","Правду кажучи, я сюди прийшла саме для цього, проте ніяк не збагну, як на мені опинилося це вбрання, -- закладаюся, це були якісь чари... {wc}Не знаю, певна річ, я звучу неначе божевільна, але мене це сильно збентежило!","Если честно, я пришла сюда узнать об этом, но совершенно не понимаю, как оказалась в этом платье! Клянусь, это было похоже на какую-то трансформацию из аниме про магических девочек... {wc} Не знаю, наверное, это звучит безумно, но я правда ничего не понимаю!""",我的確是來這邊應徵的，但我自己也不太清楚是如何得到女僕裝的，大概是像動漫內的美少女是如何登場的樣子吧！她們都會在討伐大怪之前華麗地換上戰鬥服裝。{wc}你可能不相信我，但連我都很困惑剛剛發生什麼事！
SAY.ENIntro.172.???,,"Haha, that sounds like a weird occurrence.","Haha, isso parece ser um acontecimento estranho.","Ха-ха, звучить химерно.","Хаха, звучит как нечто необычное.",哈哈，剛剛看似經過了一連串的怪事......
SAY.ENIntro.173.Ellie,,{i}(She doesn’t believe me...){/i},(Ela não acredita em mim...),{i}(Вона мені не вірить...){/i},{i}(Она мне не верит...){/i},{i}（她好像不太相信我......）{/i}
SAY.ENIntro.174.???,,"Here, as you might have known already, we are currently hiring at the moment and we start at $1,500 per job.{wc}Jobs usually takes an hour, though our working hours aren’t the most stable or convenient.{wc}Tell you what, I’ve taken a liking to you. All you need to do is fill out this contract and you’re all set to go!","Então, como você já deve saber, nós estamos contratando no momento e começamos com 7 mil reais por trabalho.{wc}Cada trabalho leva cerca de uma hora, embora nossas horas de trabalho não sejam as mais estáveis ou convenientes.{wc}Sabe de uma coisa, gostei de você. Tudo que você precisa fazer é preencher este contrato e você estará pronta!","Тут, як ти вже напевне знаєш, ми набираємо працівників, починаючи з виплат у розмірі $1500 за виконану роботу.{wc}Робота зазвичай займає годину, проте наш графік не надто стабільний та зручний.{wc}Знаєш, а ти мені сподобалась. Усе, що тобі потрібно, -- підписати цей контракт -- і ти готова до роботи!","Здесь, как ты, наверное, уже поняла, мы сейчас нанимаем сотрудников, и стартовая зарплата составляет 1500 долларов за задание.{wc}Обычно задания занимают около часа, хотя рабочие часы у нас не самые стабильные и удобные.{wc}Слушай, ты мне действительно понравилась. Тебе нужно только заполнить этот контракт, и ты готова!",妳可能已經看出來我們的工作起薪於每次新台幣五萬。{wc}每次工作差不多一小時，但工作內容不會是最輕鬆或方便的。{wc}不如這樣說好了，妳已經被錄取了！簽好這份契約就可以開始工作了！
SAY.ENIntro.176.Ellie,,"Ahhh, $1,500 an hour sounds like a godsend!! It’s too good to be true! I guess the unstable hours are the tradeoff.","Ahhh, 7 mil reais por hora parece um presente dos céus!! É bom demais para ser verdade! Imagino que as horas instáveis sejam o lado ruim.","Ах, $1500 за годину звучить просто неймовірно!!! Це занадто гарно, щоби бути правдою! Гадаю, це як компроміс за нестабільний графік.","Ааа, 1500 долларов в час — это просто рай!! Слишком круто, чтобы быть правдой! Наверное, нестабильные рабочие часы — это и есть тот самый компромисс.",哇！一次工作就領五萬實在是很難相信，這可能是社會上 CP 值最高的工作了吧！我在猜不穩定的工時應該就是為什麼給的薪水如此的高的原因吧！
SAY.ENIntro.178.Ellie,,"But waitwaitwait, I don’t even know much about this job!{wc}As far as I’m aware, we work as maids, but that doesn’t tell me anything! What do we even do?","Mas peraperapera, eu nem sei muito sobre esse trabalho!{wc}Pelo que eu sei, nós trabalhamos como faxineiras, mas isso não me diz nada! O que nós fazemos, de fato?","Але стійстійстій, я навіть нічого не знаю про зміст роботи!{wc}Усе, що мені досі було відомо, так це те, що ми працюємо як покоївки, але це мені мало про що говорить! Що передбачає ця робота?","Но подождите-подождите, я ведь даже толком не знаю, что за работа!{wc} Насколько я поняла, мы горничные, но это мне ничего не говорит! Чем нам вообще предстоит заниматься?",等等啊！我還不知道具體的工作內容啊！{wc}據我所知，我們以女僕的身份工作，但那好像也沒能完全解釋我們的工作內容啊！我們到底是在做什麼的？
SAY.ENIntro.179.???,,"Oh, we just clean up some messes people have made, and we are to usually work in different places, though you’ll probably be working with me.{wc}It is actually quite a simple job. You will only need to work on the easier tasks at first, such as picking up broken material and sweeping floors.{wc}Just make sure you don’t tell anyone about this job or what you do and know that I can’t answer all your questions. Our clients are pretty serious about staying private!","Ah, nós só limpamos a bagunça de algumas pessoas e, geralmente, trabalhamos em lugares diferentes, embora você provavelmente vá trabalhar comigo.{wc}Na verdade, é um trabalho bem simples. A princípio, você só terá que realizar as tarefas mais simples, como juntar coisas quebradas e varrer o chão.{wc}Só se certifique de não contar para ninguém sobre esse trabalho ou sobre o que você faz e saiba que eu não consigo responder a todas as suas perguntas. Nossos clientes levam a privacidade realmente a sério!","О, ми просто прибираємо безлад, що влаштовують люди, і зазвичай ми працюємо в різних місцях, та ти, вірогідно, працюватимеш разом зі мною.{wc}Переважно все просто. Спочатку тобі доведеться працювати лише з нескладними завданнями, як-от прибрати сміття або протерти підлогу.{wc}Тільки переконайся, щоби ти нікому не розповідала про свою роботу та свої обов’язки, та май на увазі, що я не відповідатиму на всі твої запитання. Наші клієнти дуже переймаються приватністю!","А, мы просто убираем за людьми, обычно работаем в разных местах, но, скорее всего, ты будешь работать со мной.{wc} На самом деле, работа достаточно простая. Сначала тебе предстоит заниматься лёгкими задачами, такими как сбор разбитых предметов и подметание пола.{wc} Просто не рассказывай никому о работе или о том, чем ты занимаешься, и помни, что я не смогу ответить на все твои вопросы. Наши клиенты очень серьёзно относятся к конфиденциальности!","Oh, we just clean up some messes people have made, and we are to usually work in different places, though you’ll probably be working with me.{wc}It is actually quite a simple job. You will only need to work on the easier tasks at first, such as picking up broken material and sweeping floors.{wc}Just make sure you don’t tell anyone about this job or what you do and know that I can’t answer all your questions. Our clients are pretty serious about staying private!"
SAY.ENIntro.181.Ellie,,"Mmmm... I think I’m pretty good at cleaning, and I don’t mind the privacy thing..",Humm... Eu me considero muito boa em limpeza e eu não me importo sobre a questão da privacidade...,"Гм-м... Думаю, я добра в прибиранні, та й не проти моменту з приватністю...","Ммм... Я думаю, я хорошо убираюсь, и меня не смущает эта секретность..",我覺得我對於清理還蠻在行的，而且我也不太在乎客戶對於隱私的要求。
SAY.ENIntro.183.Ellie,,"Ah! Wait! {wi}Before I sign, may I know your name?","Ah! Espere! {wi}Antes de assinar, posso saber seu nome?","А! Стривайте! {wi}Перед тим, як я поставлю підпис, як Вас звуть?","Ах! Подождите-ка! {wi}Прежде чем подписывать, как вас зовут?",對了{wi}在我簽名之前，可以先告訴我您的名字嗎？
SAY.ENIntro.184.???,,"Hahah, you can call me Miss.","Hahah, você pode me chamar de Dona.","Ха-ха, можеш називати мене Панною.","Хахах, зови меня просто Мисс.",哈哈哈，請叫我「小姐」就好了。
SAY.ENIntro.185.Ellie,,"...OK, Miss! I’ve made my decision! Hand over that contract, please!","...Tá certo, Dona! Tomei minha decisão! Me dê o contrato, por favor!","...Добре, Панно! Я вирішила! Подайте мені той контракт!","..Окей, Мисс! Я решила! Дайте мне этот контракт, пожалуйста",好的，小姐！請拿給我員工契約吧！
SAY.ENIntro.199.,,Are you really really sure?,Você tem certeza mesmo?,Ти точно-точно впевнена?,Ты точно-точно уверена?,你真的非常非常確定？
MENU.ENIntro.207,,Yes (ends the game),Sim (fim de jogo),Так (кінець гри),"""Да"" (конец игры)",是（結束遊戲）
MENU.ENIntro.208,,No (good choice),Não (boa escolha),Ні (хороший вибір),Нет (хороший выбор),否（好選擇）
CHARACTER.Ellie,,Ellie,Ellie,Еллі,Элли,艾莉
CHARACTER.Past Ellie,,Ellie,Ellie,Еллі,Элли,艾莉
CHARACTER.???,,???,???,???,???,？？？
CHARACTER.Miss,,Miss,Dona,Панна,Мисс,小姐