Key,Description,Standard,pt-br,uk,ru,zh-TW
SAY.ENIntro.215.Ellie,,...Hello! My name is Ellie!,...Olá! Meu nome é Ellie!,...Привіт! Мене звуть Еллі!,...Привет! Меня зовут Элли!,我叫做艾莉！
SAY.ENIntro.4.Ellie,,...,...,...,...,......
SAY.ENIntro.5.Ellie,,"Hmm... there’s not really much else to say, I’m just a normal girl with normal hobbies and a normal-ish job...{wc}Um, wanna know my favorite color? It's #c70a0a, a nice shade between red and red velvet!","Hmm... não há muito mais a se dizer, eu sou apenas uma garota normal com passatempos normais e um trabalho normal...{wc}Hum, quer saber qual a minha cor favorita? É a #c70a0a, um belo tom entre vermelho e carmesim!","Гм... Нічого такого більше й не скажеш. Я звичайна дівчина зі звичайними захопленнями та... цілком нормальною роботою...{wc}Е-е, знаєш, який мій улюблений колір? Це #c70a0a -- гарний відтінок між червоним та оксамитовим!","Хмм... на самом деле нечего особо рассказывать, я просто обычная девушка с обычными увлечениями и достаточно обычной работой...{wc} Эм, хочешь узнать мой любимый цвет? Это #c70a0a, красивый оттенок между красным и бархатным красным!",我好像沒有太多可以介紹的。我自己只是一個平凡的女孩，擁有平凡的興趣平凡的職業......{wc}對了，你知道我最喜歡的顏色嗎？是 #c70a0a，一種類似於龍蝦的深紅色，不錯吧！
SAY.ENIntro.105.Ellie,,"I don’t know, I’m just rambling on now...","Eu não sei, agora estou apenas divagando...","Ну ось, виходить якась нісенітниця...","Наверное, я просто несу чушь..",我不知道該講什麼了，剛剛都只是在碎唸而已......
SAY.ENIntro.7.Ellie,,"Oh! Today marks the 3 week anniversary of my first ever job. It doesn’t have any set hours, but it pays $1,500 every time I go! Can you believe it?","Oh! Hoje faz exatos 3 meses que comecei no primeiro trabalho da minha vida. Não é um trabalho com horário fixo, mas paga 7 mil reais toda vez que vou! Você acredita nisso?","Ой, сьогодні же рівно три тижні з тих пір, як я влаштувалася на свою першу роботу! Я не маю сталого графіку, проте щоразу, як приходжу, мені платять $1500. Можеш таке собі уявити?","О! Сегодня исполняется три недели с того дня, как я начала свою первую работу. У неё нет фиксированных часов, но платят 1500 долларов каждый раз, когда я иду! Ты можешь в это поверить?",對了！今天是我在我的第一份工作的第三週了！這份工作沒有固定的工時，但此份工作一次就給五萬多！你敢相信嗎？
SAY.ENIntro.6.Ellie,,"Ah, but you must be wondering ‘where are you?’ and ‘what are you wearing?’ and ‘why does your hair look so gorgeous?’.{wi} Fear not, for I am here to answer all your questions!","Ah, mas você deve estar se perguntando ""onde você está?"" e ""o que você está vestindo?"" e ""por que seu cabelo está tão lindo?"". Não tema, pois eu estou aqui para responder todas as suas perguntas!","Ах, і ти напевне дивуєшся: «Де ти працюєш?», «У що це ти вдягнена?» та «Чому твоє волосся таке вишукане?»{wi}Але не хвилюйся, бо я тут, аби відповісти на всі твої запитання!","Ах, но ты, наверное, задаёшься вопросами: 'Где ты?' и 'Что ты носишь?' и 'Почему твои волосы такие красивые?'.{wi} Не переживай, я здесь, чтобы ответить на все твои вопросы!",你可能在想，「你現在在哪？」、「你現在穿的是什麼」或是「為什麼妳的頭髮這麼好看？」等等問題。{wi}不用擔心，我就是專門回答這些問題的！
SAY.ENIntro.23.Ellie,,My first college semester is finally over!! All my pain and suffering can end!!!,Meu primeiro semestre da faculdade finalmente acabou!! Toda a minha dor e sofrimento terminaram!!!,"Нарешті, кінець першого семестру в коледжі! Блаженний кінець моїм мукам і стражданням!!!",Мой первый семестр в колледже наконец-то закончился!! Всё моё страдание и боль могут закончиться!!!,我終於脫離了大學第一年的摧殘了！所有大學期間的痛楚也終於可以停止了！
SAY.ENIntro.109.Ellie,,"Temporarily, but still...","Temporariamente, mas ainda assim...","Тимчасово, та все ж...","Временно, но всё равно...",暫時拉......但是至少可以暫時放掉一陣子
SAY.ENIntro.25.Ellie,,"Woah, what is this? A poster? It’s so cute!","Uau, o que é isso? Um cartaz? É tão fofo!","Йой, що це? Постер? Такий миленький!","Ого, что это? Постер? Какой милый!",這是什麼？一張海報？好可愛啊！
SAY.ENIntro.26.Ellie,,Hmmm..{wc}Miss Inconspicuous Maid Girl Cleaning Co... (That’s such a long name)... Now hiring for --,Hmmm..{wc}Serviços de Limpeza Dona Discreta... (Que nome longo)... Contratando agora por...,Гм-м...{wc}Клінінгова компанія «Непомітна Панна Покоївка»... (Така довга назва)... Наймає працівників за --,Хмм...{wc} Miss Inconspicuous Maid Girl Cleaning Co... (Какое длинное название)... Сейчас ведётся набор на —,{wc}小姐絕對正常女僕清潔股份有限公司（真長的名字啊）誠徵—
SAY.ENIntro.113.Ellie,,-- HUH?,HUH?,-- ГА?,-- ЧТО?,蛤！？
SAY.ENIntro.115.Ellie,,"$1,500 per day on the job?{wi} IN THIS ECONOMY!? And a day on the job meaning ... an HOUR?",7 mil reais por cada dia de trabalho? NESTA ECONOMIA!? E um dia de trabalho significando... só uma HORA?,$1500 в день на роботу?{wi} З ТАКОЮ-ТО ЕКОНОМІКОЮ?! І робочий день триває... ГОДИНУ?,"1500 долларов в день за работу?{wi} В ЭТОЙ ЭКОНОМИКЕ!? А день работы — это что, ЧАС?",一次五萬？{wi}在這種經濟下可以找到這種工作？而且只是清潔而已一小時內就有這麼多進到我的戶頭？
SAY.ENIntro.102.Ellie,,"Oh my gosh, should I just join?","Oh meu Deus, será que devo tentar?",Господи! Чи варто мені погодитися?,"О, боже, мне что, прямо сейчас записаться?",哇！我應該加入嗎？
MENU.ENIntro.35,,Money!!?? Count me in!,Dinheiro!? Tô dentro!,"ГРОШИКИ?!?! Де грошики, там і я!",Деньги!!?? Я за!,錢！？誰不愛錢？
MENU.ENIntro.36,,I think I'll pass.,Acho que não.,"Гадаю, не варто","Пожалуй, я воздержусь.",妳沒看過 ATM 上播的車手廣告嗎？看起來就牙敗牙敗的！
SAY.ENIntro.30.,,Are you sure?,Tem certeza?,Ти певна?,Ты уверена?,你確定？
MENU.ENIntro.202,,Yes (why...),Sim (por que...),Так (чому-у...),Да (почему...),對啦！（靠你裝這遊戲幹什麼）
MENU.ENIntro.203,,No (good choice),Não (boa escolha),Ні (хороший вибір),Нет (хороший выбор),再想一下（好選擇）
SAY.ENIntro.37.Ellie,,"Alright, I’m in!","Certo, tô dentro!","Гаразд, я в ділі!","Ладно, я в деле!",好！我這就去應徵！
SAY.ENIntro.118.Ellie,,"Oh, it seems the company’s building is supposed to be... the one in front of me?","Ah, parece que o prédio da empresa é... este bem na minha frente?","Так... Виходить, що будівля компанії знаходиться... прямо переді мною?","О, похоже, здание компании должно быть... то, что передо мной?",看起來這公司的建築就是我眼前的這間？
SAY.ENIntro.120.Ellie,,Let’s go!,Vamos lá!,Ходімо ж усередину!,Пошли!,走吧！
SAY.ENIntro.40.Ellie,,"Woah... wait.. hold on, what’s going on?!?!","Uau... espera... espera aí, o que tá acontecendo?!?!",Овва... Ге- стривайте! Що відбувається?!?!,Ого... подожди... что происходит?!?,剛剛發生了什麼事？
SAY.ENIntro.205.,,"Okay, if you insist...","Então tá, se você insiste...","Гараздоньки, якщо ти наполягаєш...","Ладно, если настаиваешь...",好吧！如果你堅持。
SAY.ENIntro.33.,,"And thus Ellie the normal girl with normal hobbies continued on with her normal day in her normal life in this normal, non-corrupted, world.","E então Ellie, a garota normal com passatempos normais, seguiu seu dia normal na sua vida normal neste mundo normal e não corrompido.",І ось так звичайна дівчина зі звичайними захопленнями на ім’я Еллі продовжила далі жити своїм звичайним життям у цьому звичайному й зовсім не зіпсованому світі.,"И так Элли, обычная девушка с обычными увлечениями, продолжила свой обычный день в своей обычной жизни в этом обычном, не иссечённом миром.",所以艾莉就繼續待在在她眼裡不被污染的世界內，平靜的、快的生活。
SAY.ENIntro.70.Ellie,,Today is my 3-week job anniversary with Miss!,Hoje faz 3 semanas que trabalho com a Dona!,Сьогодні вже рівно три тижні моєї спільної роботи з Панною!,Сегодня — моя трёхнедельная годовщина работы с мисс!,今天是我得到工作的第三週！
SAY.ENIntro.103.Ellie,,"Honestly, she was pretty terrible at explaining what the job actually entails...{wc}I know it all sounds so suspicious -- I didn’t even believe it at first, until I cashed in my first paycheck -- but I love seeing the money in my bank account!!","Sinceramente, ela explicou muito mal o que nosso trabalho realmente envolve...{wc}Eu não acreditei no começo, afinal parecia suspeito, até que recebi meu primeiro pagamento, e eu amo ver dinheiro na minha conta!!","Правду кажучи, вона насилу змогла мені пояснити, що моя робота передбачає...{wc}Знаю, звучить підозріло -- я й сама навіть спочатку не повірила, поки не отримала першу виплату, -- але мені подобається потік грошенят до мого гаманця.","Честно говоря, она была довольно плоха в объяснении, что именно включает в себя эта работа...{wc} Я понимаю, что это всё звучит подозрительно — я даже не поверила сначала, пока не получила свою первую зарплату — но мне нравится видеть деньги на своём счёте!",說實在話，她真的對於解釋工作細節很不在行......{wc}我知道這一切都聽起來很可疑—我一開始也不太相信，直到我收到帳單。—我最喜歡看到的就是自己的帳戶又多了一筆錢！！
SAY.ENIntro.134.Ellie,,"It’s just tough discovering things about the job I should've been told about, like how atrocious the hours really are.{wc}I said something about it, but Miss told me that I should’ve read the contract -- I know, but how could anyone possibly read such a boringly long thing??","Só é chato descobrir coisas sobre esse trabalho que eu deveria ter sido informada, como, por exemplo, os turnos terríveis.{wc}Eu comentei isso, mas Dona me disse que eu deveria ter lido o contrato... eu sei, mas como alguém poderia ler uma coisa tão comprida e chata??","Хоча про деякі речі я хотіла би знати до того, як приступила до обов’язків, як-от про те, якими жорсткими бувають зміни.{wc}Я вже згадувала про це Панні, проте вона лише відповіла, що я мала уважно прочитати угоду -- знаю, та хто ж при здоровому глузді читатиме таку до болю довгу писанину?","Просто тяжело узнавать вещи о работе, о которых мне должны были сказать заранее, например, насколько ужасные на самом деле часы работы.{wc} Я что-то сказала об этом, но мисс ответила, что мне следовало прочитать контракт — я знаю, но как можно было прочитать такую скучную длинную штуку?",不過不是一切皆好。這份工作的工時真的非常非常不穩定。{wc}我有跟小姐提過，但她說這些都已經在妳簽好的契約上了—我知道契約的重要性，但誰會仔細閱讀那份無聊的冗長的文件啊？
SAY.ENIntro.136.Ellie,,"Anyways, the only shift starts at 2 AM, and I get notice a day or two beforehand if I'm lucky. If I'm not, I get the notice the day of!{wc}Sometimes my shifts are even canceled just hours before.","De qualquer forma, o turno começa às 2 da manhã e eu só sou avisada com um ou dois dias de antecedência, se eu tiver sorte. Se eu não tiver, sou avisada só no dia do trabalho!{wc}Algumas vezes meu turno é cancelado apenas horas antes do trabalho.","В будь-якому разі, єдина зміна починається о 2 ночі, і повідомлення про вихід я отримую заздалегідь за день або два, якщо пощастить. Якщо ж ні, я отримую його в той самісінький день!{wc}Буває й таке, що мою зміну скасовують навіть за годину до початку.","В любом случае, единственная смена начинается в 2 часа ночи, и я получаю уведомление за день или два, если повезет. Если не повезет — то в день смены!{wc} Иногда смены даже отменяются за несколько часов до начала.",凌晨兩點是我們工作開始的時候。雖然薪資很高，但工作的通知總是來得不穩定。運氣好時也頂多會提早幾天寄送，但大多都會工作幾小時前才寄送。不過如果當天沒有被通知，就代表我能休息一天！{wc}有時我的工作也會在工作開始前幾小時就被取消。
SAY.ENIntro.138.Ellie,,"R.I.P my sleep schedule, but anything for the money, I guess...!{","Minha rotina de sono já era, mas tudo pelo dinheiro. Eu acho...","Спочивай із миром, мій графіку сну, але на що не підеш заради грошей... гадаю.","Покойся с миром, мой режим сна, но ради денег, думаю, можно и потерпеть...!",我只好為了錢犧牲一點睡眠吧！
SAY.ENIntro.141.Ellie,,"It's currently 5 PM. I've got 9 more hours before my job today starts.{wc}Gaaaah, this day is going to be soooo long.","Já são 5 da tarde. Tenho mais 9 horas até o início do trabalho de hoje.{wc}Gaaaah, esse será um dia muuuito longo.","Зараз 5 година. Маю ще 9 годин до початку роботи.{wc}Ех, сьогоднішній день обіцяє бути довгим.","Сейчас 5 вечера. У меня ещё 9 часов до начала работы сегодня.{wc} Гаааах, этот день будет таким длинным.",現在是下午五點，離工作開始還有九小時。{wc}今天感覺是很常的一天啊！
SAY.ENIntro.83.Ellie,,"Alright, it’s 12 AM and Miss just confirmed that we have work today! Time to get ready!{wc}Huh? Do I like my job?","Certo, é meia-noite e a Dona acabou de confirmar que temos trabalho hoje! Hora de me arrumar!{wc}Hã? Se eu gosto do meu trabalho?","Добре, вже північ і Панна підтвердила, що сьогодні попрацюємо. Час збиратися!{wc}Га? Чи подобається мені моя робота?","Ладно, уже 12 ночи, и мисс только что подтвердила, что у нас есть работа сегодня! Время готовиться!{wc} Хм? Нравится ли мне моя работа?",現在是凌晨十二點然後已經被小姐通知今天的工作了！該開始準備了！{wc}你問我我喜歡現在的工作嗎？
SAY.ENIntro.142.Ellie,,"Well, I mean... the maid costume is cute! It’s my favorite part of this work. So yeah, I guess I do like it!","Bem, quero dizer... o traje de faxineira é fofo! É minha parte favorita desse trabalho. Então sim, acho que gosto!","Ну, тобто... Костюм покоївки досить милий! Ця моя улюблена частина всієї справи. Тож так, гадаю, вона мені подобається.","Ну, я имею в виду... костюм горничной милый! Это моя любимая часть этой работы. Так что да, наверное, мне это нравится!",女僕裝很好看啊！可以說穿著女僕裝總是能夠點亮自己的工作心情。
SAY.ENIntro.145.Ellie,,"It just seems a little dangerous sometimes, but Miss takes care of me really well. She’s so mature even though she’s my age. I’m really grateful for her!","Só parece ser um pouco perigoso às vezes, mas Dona toma conta de mim muito bem. Ela é tão madura, mesmo tendo a mesma idade que eu. Sou realmente grata a ela!","Просто іноді вона видається небезпечною, але Панна добре дбає про мене. Вона така доросла, хоч і одного віку зі мною. Я справді їй вдячна!","Иногда это кажется немного опасным, но мисс очень хорошо обо мне заботится. Она такая взрослая, хотя у нас одинаковый возраст. Я действительно благодарна ей!",只是有時就覺得有點危險而已，不過小姐總是會保護我的安全。雖然小姐跟我差不多年紀，但她感覺比我成熟許多！我真的非常感謝她！
SAY.ENIntro.88.Ellie,,"{i}I walk into Pocket Jewelry Shop.{wc}Unlike what the name might suggest, it’s actually a very high-end brand that apparently only sells the most high-quality jewelry.{wc}I'd like to buy some one day.{wc}Pocket Jewelry, definitely not meant to be carried in your pocket or paid with pocket money.{/i}","{i}Eu entro na loja Joias de Bolso.{wc}Ao contrário do que o nome pode sugerir, essa marca, na verdade, é de alto padrão e aparentemente só vende joias de alta qualidade.{wc}Eu gostaria de comprar alguma um dia.{wc}Joias de Bolso, definitivamente não foram feitas para serem carregadas no seu bolso ou pagas com dinheiro que cabe no bolso.{/i}","{i}Я зайшла до крамниці «Кишенькові прикраси».{wc}Попри свою назву, це насправді висококласний бренд, що продає лише високоякісні вироби.{wc}Хотіла би одного разу придбати там щось.{wc}«Кишенькові прикраси», точно не призначені для носіння в кишені або оплати кишеньковими грошима.{/i}","{i} Я вхожу в магазин Pocket Jewelry.{wc} Несмотря на то, что название может обмануть, это на самом деле очень дорогой бренд, который, как утверждается, продаёт только самые качественные украшения.{wc} Я бы хотела купить что-то когда-нибудь.{wc} Pocket Jewelry, определённо не для карманов и не для карманных денег.{/i}","{i}我徐徐走進中正珠寶店。{wc}店內似乎是專門銷售珠寶以及鑽戒的高檔店。{wc}我也希望有一天自己買得起。{wc}中正珠寶店—Pocket Jewelry, definitely not meant to be carried in your pocket or paid with pocket money.{/i}"
SAY.ENIntro.92.Miss,,"Hey there, Ellie! How are you?","E aí, Ellie! Como você está?","Гей, Еллі. Як ся маєш?","Привет, Элли! Как ты?",嘿艾莉！妳好嗎？
SAY.ENIntro.95.Ellie,,I’m doing great! How about you?,Estou ótima! E você?,Усе чудово. Як щодо Вас?,У меня всё отлично! А как у тебя?,我過得很好！妳呢？
SAY.ENIntro.146.Miss,,"Good to hear, I’m well too!{wc}As you can probably tell, we’re cleaning up after a jewelry shop robbery today.","Bom saber, eu também estou bem!{wc}Como você pode ver, iremos arrumar tudo depois de um roubo que aconteceu hoje nesta loja de joias.","Рада це чути, теж у порядку!{wc}Як ти можеш бачити, сьогодні ми прибираємо наслідки пограбування ювелірної крамниці.","Рада слышать, у меня тоже всё хорошо!{wc} Как ты, наверное, уже догадалась, сегодня мы убираемся после ограбления ювелирного магазина.",我也不錯！{wc}妳可能看得出來，今天我們要來清理一樁珠寶偷竊案現場。
SAY.ENIntro.97.Miss,,Someone broke the windows and all the cases; I’ll be fixing a few small things around the area and you can cover the more prominent issues.,Alguém quebrou as janelas e todas as vitrines dos balcões. Eu arrumarei umas coisinhas pela região e você pode se ocupar com as coisas mais relevantes.,"Хтось зламав вікна й усі вітрини; я полагоджу деякі дрібні речі, а ти можеш узятися за більш значні.","Кто-то разбил окна и все витрины; я немного поработаю над мелкими вещами в этом районе, а ты займёшься более заметными проблемами.",有人打破了窗戶和展示櫃！你來幫忙清理並修復玻璃吧！我會幫忙處理剩下的小事。
SAY.ENIntro.149.Miss,,Let’s make it a good one!,Vamos fazer um bom trabalho!,Зробімо це!,Сделаем это!,我們開始吧！
SAY.ENIntro.99.Ellie,,"{i}(Ah, I forgot to tell you the second most important part of the job -- the first being our maid dresses, of course!)","{i}(Ah, eu esqueci de lhe contar a segunda parte mais importante do trabalho [com a primeira sendo nossos trajes de faxineira, claro!])","{i}(А, я забула розповісти тобі про наступну важливу частину цієї роботи -- першою є костюм покоївки, авжеж!)","{i}(Ах, я забыла сказать тебе вторую по важности часть работы — первая, конечно же, наши платья горничных!)",{i}（我好像忘記跟你介紹我們的工作內容了，當然最重要的還是我們的女僕裝啦～）
SAY.ENIntro.151.Ellie,,"{i}(We’re actually cleaning up top secret crime scenes!){wc}(I know, it shocked me at first, too!!!)","{i}(Nós, na verdade, estamos limpando cenas de crime ultra secretas!){wc}(Eu sei, a princípio também fiquei chocada!!!)","{i}(Ми насправді прибираємо цілком таємні місця злочину!){wc}(Знаю, мене це саму було приголомшило!)","{i}(На самом деле, мы убираем на сверхсекретных местах преступлений!){wc}(Знаю, меня тоже это сначала шокировало!!!)",{i}（我們其實要清理犯案現場！）{wc}（這在一開始也有點出乎意料！）
