Key,Description,Standard,pt-br
SAY.Final.202.,,"{i}...And you say something but I don’t register it.{wc}Whatever you say can’t do anything. Sorry can’t fix this, even an “I love you” can’t.{wc}It hurts, it hurts, it HURTS. {s=60}This pain this fear this loss this blood this agony these tears --","{i}...E você diz algo mas não consigo entender.{wc}O que quer que você fale não mudará nada. Desculpas não podem consertar isso, nem um ""eu te amo"" pode. Dói, dói, DÓI. {s=60}Essa dor, esse medo, essa perda, esse sangue, esse sofrimento, essas lágrimas..."
SAY.Final.203.,,"{i}{s=60}I can’t breathe, I can’t think, my mind, my nerves, I hope I die soon, I hope it ends soon.{/s}{wc}Is this what you did to that poor guy on the floor? What do you mean then, ‘necessary evil’? {wc}No one should go through this. {wi}Except you.","{i}{s=60}Eu não consigo respirar e nem pensar... minha mente, meus nervos, espero que eu morra logo, espero que acabe logo.{/s}{wc}Foi isso que você fez com esse pobre homem jogado no chão? O que você quer dizer com ""mal necessário”?{wc}Ninguém deveria ter que passar por isso. {wi}A não ser você."
SAY.Final.204.,,"{i}Broken, you’re broken, and now I am too, and{s=60} I’m on the floor bleeding out and drowning and it hurts so much and I wish it would stop and I hate you yet in my final moments all I think of is an illusion of you.","{i}Perdida, você está perdida, e agora eu também estou, e {s=60}estou no chão sangrando, me afogando. Dói tanto e eu só queria que parasse. Eu te odeio, mas agora, nos meus últimos momentos, só consigo pensar na pessoa que você fingiu ser."
SAY.Final.307.Miss,,"...{wc}...2 minutes and 13 seconds.{wc}I’m so sorry, my dear, I tried to aim for the back.{wc}A life exchanged for another, an innocent soul I tainted traded for one of a vile being. An eye for an eye -- or, I guess a life -- and now my heart for a neck.{wc}What will happen next time? Can I keep going like this? For people who don’t even give me a second glance unless I’m giving them all I have?","…{wc}...2 minutos e 13 segundos.{wc}Me desculpe, amada, eu tentei fazer com que fosse rápido.{wc}Uma vida em troca de outra, uma alma inocente que manchei pela alma de um ser cruel. Olho por olho... ou melhor, vida por vida... e, agora, meu coração por um pescoço.{wc}O que acontecerá na próxima vez? Será que consigo continuar assim? Por pessoas que nem me olham duas vezes a não ser que eu dê a elas tudo o que tenho?"
SAY.Final.213.Miss,,"...But it’s worth it in the end. {wi}It has to be. I can’t stop now, it can’t all have been for nothing.{wc}This never-ending game of thoughts and words and morals, the screams of corruption and the grayness of fixing it, someone needs to be the Robin Hood in this life even if it breaks me.","...Mas vale a pena no fim. Tem que valer. Não posso parar agora, não pode ter sido tudo em vão.{wc}Esse jogo interminável de pensamentos, palavras e moral, os gritos da corrupção e a insipidez de consertar tudo, alguém precisa ser o Robin Hood nesse mundo, mesmo que isso acabe comigo."
SAY.Final.214.Miss,,"I was so jealous of you, Ellie, of being able to live in an illusion of a fixable world.{wc}Let me live like that too.{wc}She took my eye and you took my heart, so let me take that illusion from you.{wc}Let me breathe air that no longer suffocates me, let me believe these sacrifices are not in vain.","Eu tinha muita inveja de você, Ellie, por conseguir viver com a ilusão de um mundo corrigível.{wc}Me deixe viver assim também.{wc}Ela levou meu olho e você meu coração, então deixe-me levar essa sua ilusão.{wc}Deixe-me respirar um ar que não me sufoque mais, deixe-me acreditar que esses sacrifícios não são em vão."
SAY.Final.215.Miss,,{s=15}...{/s},{s=15}...{/s}
SAY.Final.216.Miss,,"I can only keep going on. Perhaps it’s time to find someone new, just one last time. {wi}I will miss you dearly, Ellie.","Tudo o que posso fazer é seguir em frente. Talvez esteja na hora de encontrar uma nova ajudante, uma última vez. {wi}Sentirei muita saudade de você, Ellie."
SAY.Final.222.Ellie,,...Let’s partner up.,...Vamos ser parceiras.
SAY.Final.223.Miss,,"Oh!{wc}You mean like, going to buying replacement TVs together or something? No worries, I didn’t break any TVs this time.","Ah!{wc}Você quer dizer irmos comprar televisões substitutas juntas ou algo assim? Não se preocupe, eu não quebrei nenhuma televisão dessa vez."
SAY.Final.224.Ellie,,"No, no, like... like killing...","Não, não, tipo... tipo matar..."
SAY.Final.225.Miss,,...Do you want to help with that?,...Você quer ajudar com isso?
SAY.Final.226.Ellie,,...,…
SAY.Final.233.Ellie,,"Yeah. You’re right, someone needs to help fix this world, however messed up that definition of ‘fix’ might be.","Sim. Você está certa, alguém precisa ajudar a consertar esse mundo, independente do quão perturbadora seja a definição de ""consertar""."
SAY.Final.228.,,{i}Miss's expression softens.,{i}A expressão de Dona fica mais suave.
SAY.Final.229.Miss,,"..Really? That’s the first time...{wc}You understand then, right? The demise when one is sentenced for the murder of a murderer, the dread when the rape of a child equals a month of community service simply because of the type of lawyer money can bring.","..Sério? Essa é a primeira vez…{wc}Então você entende, certo? A injustiça de ser condenado pelo assassinato de um assassino, o pavor de quando o estupro de uma criança é perdoado após um mês de serviço comunitário apenas pelo tipo de advogado que alguém rico pode contratar."
SAY.Final.230.Miss,,"But I’ve been corrupted by all this death and all these feelings.{wc}When I first took you on, I wondered if I should let you stay innocent forever. But my jealousy got the better of me, with purposely not cleaning up traces of blood and doing things in plain sight of you.{wc}So I’m sorry about that, Ellie. But I’m even more sorry for the things you’ll end up witnessing, your inevitable complete loss of innocence.","Mas eu fui corrompida por toda essa morte e esses sentimentos.{wc}Quando te contratei, me perguntei se deveria te deixar ser inocente para sempre. Mas meu ciúme falou mais alto, e acabei propositalmente não limpando traços de sangue e fazendo coisas na sua frente.{wc}Então me desculpe por isso, Ellie. Mas eu te peço ainda mais desculpas pelas coisas que você acabará testemunhando, sua inevitável perda total da inocência."
SAY.Final.234.Ellie,,"...{wc}...It’s okay, I want to help.{wi} I want to stay with you.","…{wc}...Tá tudo bem, eu quero ajudar. {wi}Eu quero ficar com você."
SAY.Final.235.Miss,,"Well then, if that’s the case, let us end as many corrupted souls as we can. We’ll become the Robin Hoods of this world together, yeah?","Bom, se esse é o caso, vamos eliminar o máximo de almas corrompidas que conseguirmos. Nós nos tornaremos os Robin Hoods desse mundo juntas, certo?"
SAY.Final.236.Ellie,,Okay...!,Certo..!
SAY.Final.240.Ellie,,Do I even have a choice?,E por acaso tenho escolha?
SAY.Final.241.Miss,,"What do you mean? Of course you do!{wc}I wouldn’t ever push you to do anything you don’t want to do. Not even in a different timeline, had you said something else.","O que você quer dizer? Claro que tem!{wc}Eu jamais te obrigaria a fazer algo que você não queira. Nem em outra linha do tempo, caso você tivesse dito algo diferente."
SAY.Final.242.Ellie,,"..No, sorry -- I mean, it’s okay, I’ll do it. I’ll help you clean.","..Não, me desculpe... quero dizer, está tudo bem. Eu farei. Eu te ajudarei a limpar."
SAY.Final.243.Miss,,"That’s my Ellie!{wc}See, even in a world of corrupted social hierarchies and people and governments, I can always depend on you.{wc}Come on, you’re cleaning up this manor today.","Essa é a minha Ellie!{wc}Veja, mesmo em um mundo de hierarquias sociais corrompidas, além de governos e pessoas, eu sempre posso contar com você.{wc}Venha, você vai limpar essa mansão hoje."
SAY.Final.245.Miss,,Let’s make today a good one!,Vamos fazer um bom trabalho!
CHARACTER.Ellie,,Ellie,Ellie
CHARACTER.Miss,,Miss,Dona